tanggal_rilis,jam_rilis,judul_berita,link
2014-07-01T00:00:00Z,1899-12-31T04:43:24Z,"Peminat Tinggi, Bus Amari Ditambah","https://beritajakarta.com/read/3238/Peminat_Tinggi,_Bus_Amari_Ditambah_"
2014-07-01T00:00:00Z,1899-12-31T09:52:23Z,Basuki Awali Safari Ramadhan di Kapuk Muara,https://beritajakarta.com/read/3239/Basuki_Awali_Safari_Ramadhan_di_Kapuk_Muara
2014-07-01T00:00:00Z,1899-12-31T10:33:03Z,Polda Kembangkan Robot Lalu Lintas dan Pariwisata,https://beritajakarta.com/read/3240/Polda_Kembangkan_Robot_Lalu_Lintas_dan_Pariwisata
2014-07-01T00:00:00Z,1899-12-31T01:16:10Z,150 Petugas Disiagakan Atasi Lampu Padam,https://beritajakarta.com/read/3243/150_Petugas_Disiagakan_Atasi_Lampu_Padam
2014-07-01T00:00:00Z,1899-12-31T01:58:11Z,Sudin P2K Bentuk Tim Khusus Teliti Laut Jakarta,https://beritajakarta.com/read/3241/Sudin_P2K_Bentuk_Tim_Khusus_Teliti_Laut_Jakarta
2014-07-01T00:00:00Z,1899-12-31T02:23:49Z,Pelayanan Puskesmas Cempaka Putih Barat I Dikeluhkan,https://beritajakarta.com/read/3242/Pelayanan_Puskesmas_Cempaka_Putih_Barat_I_Dikeluhkan
2014-07-01T00:00:00Z,1899-12-31T02:47:31Z,Penertiban Parkir Liar Berlangsung Tegang,https://beritajakarta.com/read/3246/Penertiban_Parkir_Liar_Berlangsung_Tegang
2014-07-01T00:00:00Z,1899-12-31T03:07:56Z,Daging Mengandung Belatung Ditemukan di Jakbar,https://beritajakarta.com/read/3248/Daging_Mengandung_Belatung_Ditemukan_di_Jakbar
2014-07-01T00:00:00Z,1899-12-31T03:35:24Z,"Volume Sampah Naik, TPS Liar Marak di Koja","https://beritajakarta.com/read/3247/Volume_Sampah_Naik,_TPS_Liar_Marak_di_Koja"
2014-07-01T00:00:00Z,1899-12-31T04:08:21Z,"Harga Daging Melonjak, DKI Beri Subsidi Hingga Rp 30 Ribu","https://beritajakarta.com/read/3249/Harga_Daging_Melonjak,_DKI_Beri_Subsidi_Hingga_Rp_30_Ribu"
2014-07-01T00:00:00Z,1899-12-31T04:26:57Z,APBD Perubahan DKI Akan Bertambah Rp 905 Miliar,https://beritajakarta.com/read/3251/APBD_Perubahan_DKI_Akan_Bertambah_Rp_905_Miliar
2014-07-01T00:00:00Z,1899-12-31T04:42:24Z,5 Tersangka Penganiaya Siswa SMAN 3 Ditahan,https://beritajakarta.com/read/3250/5_Tersangka_Penganiaya_Siswa_SMAN_3_Ditahan
2014-07-01T00:00:00Z,1899-12-31T05:07:31Z,Basuki Nilai Kinerja Sejumlah Pejabat Eselon II Lamban,https://beritajakarta.com/read/3252/Basuki_Nilai_Kinerja_Sejumlah_Pejabat_Eselon_II_Lamban
2014-07-01T00:00:00Z,1899-12-31T05:33:51Z,Bappeda Tolak Pengembalian Kegiatan dari SKPD,https://beritajakarta.com/read/3244/Bappeda_Tolak_Pengembalian_Kegiatan_dari_SKPD
2014-07-01T00:00:00Z,1899-12-31T06:05:18Z,Pengemis Mulai Serbu Pemukiman Warga,https://beritajakarta.com/read/3253/Pengemis_Mulai_Serbu_Pemukiman_Warga
2014-07-01T00:00:00Z,1899-12-31T07:13:49Z,Ahok Minta Disdik Tunda Penghapusan Ekskul Pencinta Alam,https://beritajakarta.com/read/3254/Ahok_Minta_Disdik_Tunda_Penghapusan_Ekskul_Pencinta_Alam
2014-07-01T00:00:00Z,1899-12-31T07:43:05Z,30 Kg Tahu Berformalin Diamankan di Jakpus,https://beritajakarta.com/read/3255/30_Kg_Tahu_Berformalin_Diamankan_di_Jakpus
2014-07-01T00:00:00Z,1899-12-31T08:22:35Z,Ahok Tolak Kunker DPRD ke Amerika,https://beritajakarta.com/read/3260/Ahok_Tolak_Kunker_DPRD_ke_Amerika
2014-07-01T00:00:00Z,1899-12-31T08:42:50Z,Kelurahan Minta Dana Taktis 4 Persen dari DPA,https://beritajakarta.com/read/3245/Kelurahan_Minta_Dana_Taktis_4_Persen_dari_DPA
2014-07-01T00:00:00Z,1899-12-31T09:04:01Z,12 Terminal di Ibu Kota Siap Layani Arus Mudik,https://beritajakarta.com/read/3258/12_Terminal_di_Ibu_Kota_Siap_Layani_Arus_Mudik
2014-07-01T00:00:00Z,1899-12-31T10:05:42Z,18 Pengurus KONI DKI Diberhentikan,https://beritajakarta.com/read/3261/18_Pengurus_KONI_DKI_Diberhentikan
2014-07-02T00:00:00Z,1899-12-31T10:28:34Z,Siswa Korban Kebakaran Terima Bantuan Seragam,https://beritajakarta.com/read/3263/Siswa_Korban_Kebakaran_Terima_Bantuan_Seragam
2014-07-02T00:00:00Z,1899-12-31T12:42:17Z,756 Pejabat DKI Wajib Isi LHKPN,https://beritajakarta.com/read/3266/756_Pejabat_DKI_Wajib_Isi_LHKPN
2014-07-02T00:00:00Z,1899-12-31T01:17:15Z,Disdik Jamin Tak Ada Jual Beli Bangku Sekolah,https://beritajakarta.com/read/3264/Disdik_Jamin_Tak_Ada_Jual_Beli_Bangku_Sekolah
2014-07-02T00:00:00Z,1899-12-31T01:35:24Z,Lift Kantor Walikota Jakpus Tak Berfungsi,https://beritajakarta.com/read/3265/Lift_Kantor_Walikota_Jakpus_Tak_Berfungsi
2014-07-02T00:00:00Z,1899-12-31T02:45:19Z,Ribuan Surat Suara di Jaktim Rusak dan Kurang,https://beritajakarta.com/read/3269/Ribuan_Surat_Suara_di_Jaktim_Rusak_dan_Kurang
2014-07-02T00:00:00Z,1899-12-31T03:12:08Z,Uji Coba ERP Dimulai Pertengahan Juli,https://beritajakarta.com/read/3268/Uji_Coba_ERP_Dimulai_Pertengahan_Juli
2014-07-02T00:00:00Z,1899-12-31T03:40:36Z,Jakut Kekurangan 1.100 Personel Damkar,https://beritajakarta.com/read/3270/Jakut_Kekurangan_1.100_Personel_Damkar
2014-07-02T00:00:00Z,1899-12-31T04:15:14Z,"Banyak Jalan Rusak, Ahok Ancam Copot Kadis PU","https://beritajakarta.com/read/3271/Banyak_Jalan_Rusak,_Ahok_Ancam_Copot_Kadis_PU"
2014-07-02T00:00:00Z,1899-12-31T04:30:01Z,Walikota Jakpus Resmikan Bedah Rumah Warga,https://beritajakarta.com/read/3267/Walikota_Jakpus_Resmikan_Bedah_Rumah_Warga
2014-07-02T00:00:00Z,1899-12-31T04:55:14Z,Tersangka Kasus SMAN 3 Dipindahkan ke Rutan Salemba,https://beritajakarta.com/read/3273/Tersangka_Kasus_SMAN_3_Dipindahkan_ke_Rutan_Salemba
2014-07-02T00:00:00Z,1899-12-31T05:05:08Z,"Antisipasi Kemacetan, Dishub Awasi Pasar Tumpah","https://beritajakarta.com/read/3278/Antisipasi_Kemacetan,_Dishub_Awasi_Pasar_Tumpah_"
2014-07-02T00:00:00Z,1899-12-31T05:20:11Z,"Tanpa IMB, Bangunan Usaha Mebel Dibongkar","https://beritajakarta.com/read/3281/Tanpa_IMB,_Bangunan_Usaha_Mebel_Dibongkar_"
2014-07-02T00:00:00Z,1899-12-31T05:40:12Z,Harga Sembako di Sejumlah Pasar Mengalami Kenaikan,https://beritajakarta.com/read/3274/Harga_Sembako_di_Sejumlah_Pasar_Mengalami_Kenaikan
2014-07-02T00:00:00Z,1899-12-31T06:10:56Z,Ahok Tolak ERP dengan Teknologi GPS,https://beritajakarta.com/read/3284/Ahok_Tolak_ERP_dengan_Teknologi_GPS
2014-07-02T00:00:00Z,1899-12-31T06:28:44Z,Jajanan PKL Monas Mengandung Bahan Berbahaya,https://beritajakarta.com/read/3280/Jajanan_PKL_Monas_Mengandung_Bahan_Berbahaya
2014-07-02T00:00:00Z,1899-12-31T06:50:23Z,Pengadaan Alat Olahraga KONI DKI Tunggu Lelang ULP,https://beritajakarta.com/read/3279/Pengadaan_Alat_Olahraga_KONI_DKI_Tunggu_Lelang_ULP_
2014-07-02T00:00:00Z,1899-12-31T07:00:03Z,"2 BUMD DKI Akan Disuntik Modal Rp 4,9 Triliun","https://beritajakarta.com/read/3276/2_BUMD_DKI_Akan_Disuntik_Modal_Rp_4,9_Triliun"
2014-07-02T00:00:00Z,1899-12-31T07:20:40Z,"Wisatawan Melonjak, Kepulauan Seribu Minim Penginapan","https://beritajakarta.com/read/3272/_Wisatawan_Melonjak,_Kepulauan_Seribu_Minim_Penginapan"
2014-07-02T00:00:00Z,1899-12-31T07:40:44Z,DKI Akan Gelar Pasar Murah Usai Pilpres,https://beritajakarta.com/read/3285/DKI_Akan_Gelar_Pasar_Murah_Usai_Pilpres
2014-07-02T00:00:00Z,1899-12-31T08:00:32Z,"Bersihkan Got dan Taman, DKI Bakal Rekrut Ribuan Satgas","https://beritajakarta.com/read/3286/Bersihkan_Got_dan_Taman,_DKI_Bakal_Rekrut_Ribuan_Satgas"
2014-07-02T00:00:00Z,1899-12-31T08:53:49Z,UKP4 Bahas Pembangunan Stadion BMW,https://beritajakarta.com/read/3283/UKP4_Bahas_Pembangunan_Stadion_BMW_
2014-07-02T00:00:00Z,1899-12-31T09:30:32Z,Usulan Dana Taktis Didukung Dewan Kota,https://beritajakarta.com/read/3277/Usulan_Dana_Taktis_Didukung_Dewan_Kota
2014-07-03T00:00:00Z,1899-12-31T10:02:25Z,Sudin Damkar Jakpus Kewalahan Tangani Kebakaran,https://beritajakarta.com/read/3289/Sudin_Damkar_Jakpus_Kewalahan_Tangani_Kebakaran
2014-07-03T00:00:00Z,1899-12-31T10:41:53Z,Bus Transjakarta Tabrak Median Jalan,https://beritajakarta.com/read/3290/Bus_Transjakarta_Tabrak_Median_Jalan
2014-07-03T00:00:00Z,1899-12-31T11:17:05Z,43 Rumah Kampung Deret Belum Dialiri Listrik,https://beritajakarta.com/read/3291/43_Rumah_Kampung_Deret_Belum_Dialiri_Listrik
2014-07-03T00:00:00Z,1899-12-31T01:18:40Z,Kakek Terkapar Ditabrak KA Taksaka,https://beritajakarta.com/read/3293/Kakek_Terkapar_Ditabrak_KA_Taksaka
2014-07-03T00:00:00Z,1899-12-31T01:35:06Z,Pergub Penyatuan Monas Rampung Akhir Juli,https://beritajakarta.com/read/3292/Pergub_Penyatuan_Monas_Rampung_Akhir_Juli
2014-07-03T00:00:00Z,1899-12-31T02:00:54Z,"Gerbang ERP Dipasang, Sebagian Jalan Sudirman Ditutup","https://beritajakarta.com/read/3295/Gerbang_ERP_Dipasang,_Sebagian_Jalan_Sudirman_Ditutup_"
2014-07-03T00:00:00Z,1899-12-31T02:50:38Z,Camat Gambir Kewalahan Atasi Pedagang Velg Mobil,https://beritajakarta.com/read/3296/Camat_Gambir_Kewalahan_Atasi_Pedagang_Velg_Mobil
2014-07-03T00:00:00Z,1899-12-31T03:10:07Z,Korban Tewas Penganiayaan Ekskul SMAN 3 Bertambah,https://beritajakarta.com/read/3301/Korban_Tewas_Penganiayaan_Ekskul_SMAN_3_Bertambah
2014-07-03T00:00:00Z,1899-12-31T03:30:41Z,32 Penghuni Rusun Marunda Belum Mutasikan KTP,https://beritajakarta.com/read/3300/32_Penghuni_Rusun_Marunda_Belum_Mutasikan_KTP
2014-07-03T00:00:00Z,1899-12-31T04:11:48Z,Pembangunan RTH Kalijodo Tunggu Usulan Distankam,https://beritajakarta.com/read/3302/Pembangunan_RTH_Kalijodo_Tunggu_Usulan_Distankam
2014-07-03T00:00:00Z,1899-12-31T04:35:13Z,Transparansi untuk Kuatkan Pondasi Pemprov DKI,https://beritajakarta.com/read/3304/Transparansi_untuk_Kuatkan_Pondasi_Pemprov_DKI
2014-07-03T00:00:00Z,1899-12-31T05:08:12Z,400 Bangunan Bermasalah Akan Ditertibkan,https://beritajakarta.com/read/3306/400_Bangunan_Bermasalah_Akan_Ditertibkan
2014-07-03T00:00:00Z,1899-12-31T05:18:38Z,Kantor Walikota Jaktim Marak Kucing Liar,https://beritajakarta.com/read/3305/Kantor_Walikota_Jaktim_Marak_Kucing_Liar
2014-07-03T00:00:00Z,1899-12-31T05:37:51Z,Disdik: Fandian Meninggal Terkena Bisa Beracun,https://beritajakarta.com/read/3309/Disdik:_Fandian_Meninggal_Terkena_Bisa_Beracun
2014-07-03T00:00:00Z,1899-12-31T06:16:07Z,Partisipasi Pejabat Laporkan Kekayaan Masih Rendah,https://beritajakarta.com/read/3310/Partisipasi_Pejabat_Laporkan_Kekayaan_Masih_Rendah
2014-07-03T00:00:00Z,1899-12-31T07:08:34Z,Sejumlah Rumah di Kalibaru Bakal Dibongkar,https://beritajakarta.com/read/3308/Sejumlah_Rumah_di_Kalibaru_Bakal_Dibongkar
2014-07-03T00:00:00Z,1899-12-31T07:38:47Z,Gaji Satpol PP PTT Akan Dinaikkan Jadi Rp 5 Juta,https://beritajakarta.com/read/3312/Gaji_Satpol_PP_PTT_Akan_Dinaikkan_Jadi_Rp_5_Juta
2014-07-03T00:00:00Z,1899-12-31T07:53:12Z,Transjakarta Batal Tambah Bus Tahun Ini,https://beritajakarta.com/read/3313/Transjakarta_Batal_Tambah_Bus_Tahun_Ini
2014-07-03T00:00:00Z,1899-12-31T08:05:07Z,Ahok Ingin Ramadhan Sepanjang Tahun,https://beritajakarta.com/read/3316/Ahok_Ingin_Ramadhan_Sepanjang_Tahun
2014-07-03T00:00:00Z,1899-12-31T08:23:02Z,Terminal Pulogebang Akan Digunakan Angkut Pemudik,https://beritajakarta.com/read/3315/Terminal_Pulogebang_Akan_Digunakan_Angkut_Pemudik
2014-07-03T00:00:00Z,1899-12-31T09:30:37Z,"Minim Perawatan, 20 Truk Sampah Jadi Rongsokan","https://beritajakarta.com/read/3303/Minim_Perawatan,_20_Truk_Sampah_Jadi_Rongsokan_"
2014-07-03T00:00:00Z,1899-12-31T09:55:23Z,Perbaikan Jembatan Bendungan Melayu Kembali Mangkrak,https://beritajakarta.com/read/3314/Perbaikan_Jembatan_Bendungan_Melayu_Kembali_Mangkrak
2014-07-03T00:00:00Z,1899-12-31T10:00:46Z,Basuki Bakal Jadikan Rudi Siahaan Staf Biasa,https://beritajakarta.com/read/3307/Basuki_Bakal_Jadikan_Rudi_Siahaan_Staf_Biasa_
2014-07-04T00:00:00Z,1899-12-31T10:05:11Z,Sterilisasi Tiga Koridor Bus Transjakarta Diperketat,https://beritajakarta.com/read/3318/Sterilisasi_Tiga_Koridor_Bus_Transjakarta_Diperketat
2014-07-04T00:00:00Z,1899-12-31T10:42:28Z,"Pantau Mudik Lebaran, Dishub Siapkan ""e-Report""","https://beritajakarta.com/read/3319/Pantau_Mudik_Lebaran,_Dishub_Siapkan_""e-Report"""
2014-07-04T00:00:00Z,1899-12-31T11:16:36Z,Ratusan Atribut Kampanye Pilpres Dicopot,https://beritajakarta.com/read/3320/Ratusan_Atribut_Kampanye_Pilpres_Dicopot
2014-07-04T00:00:00Z,1899-12-31T12:48:58Z,"Rumah Mewah Terbakar, Satu Penghuni Terluka","https://beritajakarta.com/read/3322/Rumah_Mewah_Terbakar,_Satu_Penghuni_Terluka"
2014-07-04T00:00:00Z,1899-12-31T01:11:03Z,"Transjakarta Tabrak Pohon, 21 Orang Luka-luka","https://beritajakarta.com/read/3323/Transjakarta_Tabrak_Pohon,_21_Orang_Luka-luka"
2014-07-04T00:00:00Z,1899-12-31T01:18:08Z,ERP Siap Diuji Coba 15 Juli,https://beritajakarta.com/read/3321/ERP_Siap_Diuji_Coba_15_Juli_
2014-07-04T00:00:00Z,1899-12-31T02:10:34Z,Basuki Optimis Warga Antusias Ikut Uji Coba ERP,https://beritajakarta.com/read/3324/Basuki_Optimis_Warga_Antusias_Ikut_Uji_Coba_ERP
2014-07-04T00:00:00Z,1899-12-31T03:10:11Z,"Buka Siang Hari, Restoran Terbakar","https://beritajakarta.com/read/3328/Buka_Siang_Hari,_Restoran_Terbakar"
2014-07-04T00:00:00Z,1899-12-31T03:31:41Z,Tarif ERP Dinaikkan Jika Lebih 1.500 Mobil Per Jam,https://beritajakarta.com/read/3330/Tarif_ERP_Dinaikkan_Jika_Lebih_1.500_Mobil_Per_Jam
2014-07-04T00:00:00Z,1899-12-31T04:05:06Z,Korban Kecelakaan Bus Transjakarta Sudah Pulang dari RS,https://beritajakarta.com/read/3332/Korban_Kecelakaan_Bus_Transjakarta_Sudah_Pulang_dari_RS
2014-07-04T00:00:00Z,1899-12-31T04:20:21Z,2.875 PKL Akan Terapkan Retribusi Non Tunai,https://beritajakarta.com/read/3329/2.875_PKL_Akan_Terapkan_Retribusi_Non_Tunai
2014-07-04T00:00:00Z,1899-12-31T04:35:09Z,Kantor Kelurahan Pondok Kopi Rusak Berat,https://beritajakarta.com/read/3327/Kantor_Kelurahan_Pondok_Kopi_Rusak_Berat
2014-07-04T00:00:00Z,1899-12-31T05:13:05Z,Basuki: Bus Tua Penyebab Kecelakaan Transjakarta,https://beritajakarta.com/read/3334/Basuki:_Bus_Tua_Penyebab_Kecelakaan_Transjakarta
2014-07-04T00:00:00Z,1899-12-31T05:39:17Z,187 Pemilik Bangunan Tanpa Izin Didenda,https://beritajakarta.com/read/3325/187_Pemilik_Bangunan_Tanpa_Izin_Didenda_
2014-07-04T00:00:00Z,1899-12-31T06:10:06Z,Bocah Dipaksa Jadi Pengamen Hingga Sakit,https://beritajakarta.com/read/3335/Bocah_Dipaksa_Jadi_Pengamen_Hingga_Sakit
2014-07-04T00:00:00Z,1899-12-31T06:35:50Z,"Minim Lahan Parkir, Jalan di Jakut Marak Parkir Liar","https://beritajakarta.com/read/3333/Minim_Lahan_Parkir,_Jalan_di_Jakut_Marak_Parkir_Liar"
2014-07-04T00:00:00Z,1899-12-31T07:40:52Z,"Diduga Human Trafficking, 7 ABG Disekap di Rumah Kos","https://beritajakarta.com/read/3338/Diduga_Human_Trafficking,_7_ABG_Disekap_di_Rumah_Kos"
2014-07-04T00:00:00Z,1899-12-31T08:06:09Z,"Cegah Kebakaran, Warga Dilatih Padamkan Api","https://beritajakarta.com/read/3336/Cegah_Kebakaran,_Warga_Dilatih_Padamkan_Api"
2014-07-04T00:00:00Z,1899-12-31T08:41:05Z,"Agustus, Revitalisasi Pasar IRTI Monas Rampung","https://beritajakarta.com/read/3337/Agustus,_Revitalisasi_Pasar_IRTI_Monas_Rampung"
2014-07-04T00:00:00Z,1899-12-31T09:12:18Z,Ratusan Bangunan Liar di Jl Kartini Akan Ditertibkan,https://beritajakarta.com/read/3326/Ratusan_Bangunan_Liar_di_Jl_Kartini_Akan_Ditertibkan
2014-07-04T00:00:00Z,1899-12-31T09:43:31Z,"Ahok: Ijazah Ditahan, Lapor ke Saya","https://beritajakarta.com/read/3339/Ahok:_Ijazah_Ditahan,_Lapor_ke_Saya"
2014-07-05T00:00:00Z,1899-12-31T01:09:16Z,KPU Targetkan 75 Persen Warga DKI Mencoblos,https://beritajakarta.com/read/3342/KPU_Targetkan_75_Persen_Warga_DKI_Mencoblos
2014-07-05T00:00:00Z,1899-12-31T01:47:24Z,Dishub Kewalahan Atasi Macet Tanah Abang,https://beritajakarta.com/read/3341/Dishub_Kewalahan_Atasi_Macet_Tanah_Abang
2014-07-05T00:00:00Z,1899-12-31T02:19:20Z,Patroli Sahur Antisipasi Tawuran Warga,https://beritajakarta.com/read/3340/Patroli_Sahur_Antisipasi_Tawuran_Warga_
2014-07-05T00:00:00Z,1899-12-31T02:48:44Z,Warga Keluhkan Dokter Puskesmas Datang Telat,https://beritajakarta.com/read/3343/Warga_Keluhkan_Dokter_Puskesmas_Datang_Telat
2014-07-05T00:00:00Z,1899-12-31T03:06:22Z,"Retribusi Non Tunai Diberlakukan, Pengurus Pasar Pasrah","https://beritajakarta.com/read/3344/Retribusi_Non_Tunai_Diberlakukan,_Pengurus_Pasar_Pasrah"
2014-07-05T00:00:00Z,1899-12-31T04:04:23Z,Pasar Murah di Jakpus Akan Jual Sembako Setengah Harga,https://beritajakarta.com/read/3346/Pasar_Murah_di_Jakpus_Akan_Jual_Sembako_Setengah_Harga
2014-07-05T00:00:00Z,1899-12-31T05:40:45Z,Lampu Taman Walikota Jaktim Banyak yang Rusak,https://beritajakarta.com/read/3345/Lampu_Taman_Walikota_Jaktim_Banyak_yang_Rusak
2014-07-05T00:00:00Z,1899-12-31T06:12:15Z,Biro Wisata Diharapkan Tambah Penginapan di Kepulauan Seribu,https://beritajakarta.com/read/3347/Biro_Wisata_Diharapkan_Tambah_Penginapan_di_Kepulauan_Seribu
2014-07-06T00:00:00Z,1899-12-31T11:38:04Z,Pembayaran Sewa Rusun Bisa Lewat CMS Bank DKI,https://beritajakarta.com/read/3348/Pembayaran_Sewa_Rusun_Bisa_Lewat_CMS_Bank_DKI
2014-07-06T00:00:00Z,1899-12-31T02:09:03Z,Kali Rawa Rengas Dinormalisasi,https://beritajakarta.com/read/3349/Kali_Rawa_Rengas_Dinormalisasi
2014-07-06T00:00:00Z,1899-12-31T02:20:30Z,Puluhan Ribu Atribut Kampanye Pilpres Ditertibkan,https://beritajakarta.com/read/3353/Puluhan_Ribu_Atribut_Kampanye_Pilpres_Ditertibkan
2014-07-06T00:00:00Z,1899-12-31T04:08:31Z,"Dikepung Massa, Copet di Transjakarta Terjun ke Kali","https://beritajakarta.com/read/3357/Dikepung_Massa,_Copet_di_Transjakarta_Terjun_ke_Kali"
2014-07-06T00:00:00Z,1899-12-31T04:33:18Z,Walikota Ajak Warga Tak Golput,https://beritajakarta.com/read/3350/Walikota_Ajak_Warga_Tak_Golput
2014-07-06T00:00:00Z,1899-12-31T05:01:06Z,Masyarakat Diimbau Jangan Golput,https://beritajakarta.com/read/3358/Masyarakat_Diimbau_Jangan_Golput
2014-07-06T00:00:00Z,1899-12-31T06:22:51Z,PMKS Makin Marak di Jakarta Barat,https://beritajakarta.com/read/3354/PMKS_Makin_Marak_di_Jakarta_Barat
2014-07-06T00:00:00Z,1899-12-31T07:05:58Z,4.412 Atribut Kampanye Ditertibkan,https://beritajakarta.com/read/3351/4.412_Atribut_Kampanye_Ditertibkan
2014-07-07T00:00:00Z,1899-12-31T10:44:39Z,Jaksel Kewalahan Angkut Sampah,https://beritajakarta.com/read/3359/Jaksel_Kewalahan_Angkut_Sampah
2014-07-07T00:00:00Z,1899-12-31T11:35:58Z,Pembakar Jukir Monas Resmi Dipecat dari TNI,https://beritajakarta.com/read/3360/Pembakar_Jukir_Monas_Resmi_Dipecat_dari_TNI
2014-07-07T00:00:00Z,1899-12-31T01:26:46Z,Jokowi Nyoblos di TPS 17 Menteng,https://beritajakarta.com/read/3362/Jokowi_Nyoblos_di_TPS_17_Menteng
2014-07-07T00:00:00Z,1899-12-31T02:16:10Z,Transjakarta Tetap Beroperasi Normal Saat Pilpres,https://beritajakarta.com/read/3363/Transjakarta_Tetap_Beroperasi_Normal_Saat_Pilpres
2014-07-07T00:00:00Z,1899-12-31T02:39:24Z,"Minim Anggaran, Kinerja Sudin KUMKMP Tidak Maksimal","https://beritajakarta.com/read/3361/Minim_Anggaran,_Kinerja_Sudin_KUMKMP_Tidak_Maksimal"
2014-07-07T00:00:00Z,1899-12-31T03:10:25Z,Ahok Sesalkan Masih Banyak Atribut Kampanye,https://beritajakarta.com/read/3365/Ahok_Sesalkan_Masih_Banyak_Atribut_Kampanye
2014-07-07T00:00:00Z,1899-12-31T03:35:03Z,"Pilpres, 100 Polisi Jaga Waduk Pluit","https://beritajakarta.com/read/3364/Pilpres,_100_Polisi_Jaga_Waduk_Pluit_"
2014-07-07T00:00:00Z,1899-12-31T04:05:12Z,Warga Protes Bus Kota Lewati Pemukiman,https://beritajakarta.com/read/3368/Warga_Protes_Bus_Kota_Lewati_Pemukiman
2014-07-07T00:00:00Z,1899-12-31T04:40:19Z,Kantor Kelurahan Kalianyar Rusak Parah,https://beritajakarta.com/read/3367/Kantor_Kelurahan_Kalianyar_Rusak_Parah
2014-07-07T00:00:00Z,1899-12-31T05:09:50Z,DKI Akan Lebih Selektif Bangun Kampung Deret,https://beritajakarta.com/read/3376/DKI_Akan_Lebih_Selektif_Bangun_Kampung_Deret
2014-07-07T00:00:00Z,1899-12-31T05:30:30Z,"Truk Kontainer Terguling, Jl Yos Sudarso Macet Parah","https://beritajakarta.com/read/3378/Truk_Kontainer_Terguling,_Jl_Yos_Sudarso_Macet_Parah"
2014-07-07T00:00:00Z,1899-12-31T05:51:09Z,Sejumlah Jalan di Jaktim Mulai Diperbaiki,https://beritajakarta.com/read/3371/Sejumlah_Jalan_di_Jaktim_Mulai_Diperbaiki
2014-07-07T00:00:00Z,1899-12-31T06:30:21Z,Harga Pangan di Jaktim Masih Stabil,https://beritajakarta.com/read/3373/Harga_Pangan_di_Jaktim_Masih_Stabil
2014-07-07T00:00:00Z,1899-12-31T06:43:10Z,Hujan Deras Sisakan 24 Titik Genangan,https://beritajakarta.com/read/3382/Hujan_Deras_Sisakan_24_Titik_Genangan
2014-07-07T00:00:00Z,1899-12-31T06:49:58Z,Anggaran Pembelian Bus Dicoret dalam APBD DKI 2014,https://beritajakarta.com/read/3379/Anggaran_Pembelian_Bus_Dicoret_dalam_APBD_DKI_2014
2014-07-07T00:00:00Z,1899-12-31T07:05:22Z,"Tergenang, Underpass Gandaria Ditutup","https://beritajakarta.com/read/3383/Tergenang,_Underpass_Gandaria_Ditutup"
2014-07-07T00:00:00Z,1899-12-31T07:22:22Z,"Bulan Ramadhan, PSK Masih Berkeliaran di Kemayoran","https://beritajakarta.com/read/3366/Bulan_Ramadhan,_PSK_Masih_Berkeliaran_di_Kemayoran"
2014-07-07T00:00:00Z,1899-12-31T08:12:39Z,Kantor Sudin KUMKMP Jakpus Digeruduk PKL,https://beritajakarta.com/read/3385/Kantor_Sudin_KUMKMP_Jakpus_Digeruduk_PKL
2014-07-07T00:00:00Z,1899-12-31T08:25:27Z,Tiang Listrik di DKI Akan Dipasang CCTV,https://beritajakarta.com/read/3377/_Tiang_Listrik_di_DKI_Akan_Dipasang_CCTV
2014-07-07T00:00:00Z,1899-12-31T08:48:09Z,Takjil Banyak Mengandung Zat Berbahaya,https://beritajakarta.com/read/3380/Takjil_Banyak_Mengandung_Zat_Berbahaya
2014-07-07T00:00:00Z,1899-12-31T09:10:01Z,"Usai Lebaran, Penyerobot Jalur Transjakarta Dikenai Denda Maksimal","https://beritajakarta.com/read/3381/Usai_Lebaran,_Penyerobot_Jalur_Transjakarta_Dikenai_Denda_Maksimal"
2014-07-07T00:00:00Z,1899-12-31T09:29:14Z,Indeks Demokrasi DKI Turun ke Peringkat 5,https://beritajakarta.com/read/3386/Indeks_Demokrasi_DKI_Turun_ke_Peringkat_5
2014-07-07T00:00:00Z,1899-12-31T10:04:46Z,"Agustus, Kampung Deret Kalianyar Dibangun","https://beritajakarta.com/read/3370/Agustus,_Kampung_Deret_Kalianyar_Dibangun"
2014-07-07T00:00:00Z,1899-12-31T10:11:19Z,Volume Sampah di Jakut Naik Hingga 5 Persen,https://beritajakarta.com/read/3374/Volume_Sampah_di_Jakut_Naik_Hingga_5_Persen
2014-07-08T00:00:00Z,1899-12-31T10:28:14Z,KPU DKI Siapkan 40 TPS di Penjara,https://beritajakarta.com/read/3388/KPU_DKI_Siapkan_40_TPS_di_Penjara
2014-07-08T00:00:00Z,1899-12-31T11:10:40Z,Penertiban Atribut Kampanye Fokus di Pemukiman,https://beritajakarta.com/read/3389/Penertiban_Atribut_Kampanye_Fokus_di_Pemukiman
2014-07-08T00:00:00Z,1899-12-31T01:07:52Z,"Pilpres, Satpol PP Dilarang Cuti","https://beritajakarta.com/read/3392/Pilpres,_Satpol_PP_Dilarang_Cuti"
2014-07-08T00:00:00Z,1899-12-31T01:58:24Z,Proyek Normalisasi Kali Pesanggrahan Terancam Molor,https://beritajakarta.com/read/3394/Proyek_Normalisasi_Kali_Pesanggrahan_Terancam_Molor
2014-07-08T00:00:00Z,1899-12-31T02:15:10Z,Polisi Antisipasi 187 Titik Rawan Rusuh di Jakut,https://beritajakarta.com/read/3396/Polisi_Antisipasi_187_Titik_Rawan_Rusuh_di_Jakut
2014-07-08T00:00:00Z,1899-12-31T02:40:47Z,"Ramadhan, Perpustakaan Sepi Pengunjung","https://beritajakarta.com/read/3397/Ramadhan,_Perpustakaan_Sepi_Pengunjung"
2014-07-08T00:00:00Z,1899-12-31T03:05:16Z,Wartawan Top Skor Tewas Jadi Korban Tabrak Lari,https://beritajakarta.com/read/3401/Wartawan_Top_Skor_Tewas_Jadi_Korban_Tabrak_Lari
2014-07-08T00:00:00Z,1899-12-31T03:32:51Z,Ahok Ingin E-KTP Multifungsi,https://beritajakarta.com/read/3403/Ahok_Ingin_E-KTP_Multifungsi
2014-07-08T00:00:00Z,1899-12-31T03:40:46Z,"Panjat JPO, Agustinus Diamankan Satpol PP","https://beritajakarta.com/read/3400/Panjat_JPO,_Agustinus_Diamankan_Satpol_PP"
2014-07-08T00:00:00Z,1899-12-31T04:05:56Z,Basuki Imbau Warga Jakarta Tak Golput,https://beritajakarta.com/read/3402/_Basuki_Imbau_Warga_Jakarta_Tak_Golput
2014-07-08T00:00:00Z,1899-12-31T04:30:24Z,Logistik Pemilu Pulau Seribu Rampung Hari ini,https://beritajakarta.com/read/3398/Logistik_Pemilu_Pulau_Seribu_Rampung_Hari_ini
2014-07-08T00:00:00Z,1899-12-31T05:05:20Z,"2015, Ruang Bawah Tanah Monas Mulai Dibangun","https://beritajakarta.com/read/3408/2015,_Ruang_Bawah_Tanah_Monas_Mulai_Dibangun"
2014-07-08T00:00:00Z,1899-12-31T05:20:55Z,2 Pekerja Bangunan Tewas Tenggak Miras Oplosan,https://beritajakarta.com/read/3412/2_Pekerja_Bangunan_Tewas_Tenggak_Miras_Oplosan
2014-07-08T00:00:00Z,1899-12-31T05:40:28Z,"5,5 Kg Daging Sapi Tak Layak Konsumsi Disita","https://beritajakarta.com/read/3407/5,5_Kg_Daging_Sapi_Tak_Layak_Konsumsi_Disita"
2014-07-08T00:00:00Z,1899-12-31T06:10:01Z,DKI Larang Mobil Dinas untuk Mudik,https://beritajakarta.com/read/3413/DKI_Larang_Mobil_Dinas_untuk_Mudik
2014-07-08T00:00:00Z,1899-12-31T06:30:54Z,DKI Akan Berlakukan Kartu Anggota PKL,https://beritajakarta.com/read/3411/DKI_Akan_Berlakukan_Kartu_Anggota_PKL
2014-07-08T00:00:00Z,1899-12-31T07:15:27Z,Lonjakan Pemudik di Kampung Rambutan H-10 Lebaran,https://beritajakarta.com/read/3410/Lonjakan_Pemudik_di_Kampung_Rambutan_H-10_Lebaran
2014-07-08T00:00:00Z,1899-12-31T07:45:21Z,Warga Hias TPS dengan Barang Bekas,https://beritajakarta.com/read/3415/Warga_Hias_TPS_dengan_Barang_Bekas
2014-07-08T00:00:00Z,1899-12-31T07:50:38Z,"Jakarta Tergenang, Basuki Kembali Soroti Kinerja Dinas PU","https://beritajakarta.com/read/3405/Jakarta_Tergenang,_Basuki_Kembali_Soroti_Kinerja_Dinas_PU"
2014-07-08T00:00:00Z,1899-12-31T08:11:20Z,Penambahan Taman Kota Terkendala Lahan,https://beritajakarta.com/read/3404/Penambahan_Taman_Kota_Terkendala_Lahan
2014-07-08T00:00:00Z,1899-12-31T08:45:16Z,Tumpukan Sampah di Tamansari Tebar Aroma Bau Busuk,https://beritajakarta.com/read/3399/Tumpukan_Sampah_di_Tamansari_Tebar_Aroma_Bau_Busuk
2014-07-08T00:00:00Z,1899-12-31T09:05:13Z,Ratusan Kepsek di DKI Tunggu Hasil Sertifikasi,https://beritajakarta.com/read/3416/Ratusan_Kepsek_di_DKI_Tunggu_Hasil_Sertifikasi
2014-07-08T00:00:00Z,1899-12-31T09:20:12Z,Warga Petojo Selatan Ajukan Keringanan Tarif PBB,https://beritajakarta.com/read/3417/Warga_Petojo_Selatan_Ajukan_Keringanan_Tarif_PBB
2014-07-09T00:00:00Z,1899-12-31T09:53:08Z,"Pilpres, UGD Puskesmas dan RSUD Tetap Buka","https://beritajakarta.com/read/3419/Pilpres,_UGD_Puskesmas_dan_RSUD_Tetap_Buka"
2014-07-09T00:00:00Z,1899-12-31T10:40:16Z,"Hari Pencoblosan, Jakarta Lengang","https://beritajakarta.com/read/3421/Hari_Pencoblosan,_Jakarta_Lengang"
2014-07-09T00:00:00Z,1899-12-31T11:15:04Z,Kartu Identitas PNS DKI Bisa Tarik Uang di ATM,https://beritajakarta.com/read/3422/Kartu_Identitas_PNS_DKI_Bisa_Tarik_Uang_di_ATM
2014-07-09T00:00:00Z,1899-12-31T12:55:39Z,TPS Jokowi Dikawal 100 Polisi,https://beritajakarta.com/read/3425/_TPS_Jokowi_Dikawal_100_Polisi
