tanggal_rilis,jam_rilis,judul_berita,link
2014-08-01T00:00:00Z,1899-12-31T11:14:10Z,Kondisi Pantai Publik Marunda Memprihatinkan,https://beritajakarta.com/read/3901/Kondisi_Pantai_Publik_Marunda_Memprihatinkan
2014-08-01T00:00:00Z,1899-12-31T01:05:16Z,Puluhan Lapak PKL di Jl Bendungan Melayu Dibongkar,https://beritajakarta.com/read/3909/Puluhan_Lapak_PKL_di_Jl_Bendungan_Melayu_Dibongkar
2014-08-01T00:00:00Z,1899-12-31T02:14:40Z,Arus Balik di Terminal Kampung Rambutan Ramai,https://beritajakarta.com/read/3911/Arus_Balik_di_Terminal_Kampung_Rambutan_Ramai
2014-08-01T00:00:00Z,1899-12-31T03:10:15Z,"Lebaran, Volume Sampah di Jakbar Menurun","https://beritajakarta.com/read/3910/Lebaran,_Volume_Sampah_di_Jakbar_Menurun_"
2014-08-01T00:00:00Z,1899-12-31T04:20:37Z,"Penjualan Solar Bersubsidi Distop, SPBU di Jakpus Sepi","https://beritajakarta.com/read/3913/Penjualan_Solar_Bersubsidi_Distop,_SPBU_di_Jakpus_Sepi_"
2014-08-01T00:00:00Z,1899-12-31T05:13:08Z,Hutan Kota Srengseng Dibanjiri Pengunjung,https://beritajakarta.com/read/3914/Hutan_Kota_Srengseng_Dibanjiri_Pengunjung
2014-08-01T00:00:00Z,1899-12-31T05:50:31Z,"Pasca Lebaran, Senen Bersih dari PKL","https://beritajakarta.com/read/3908/Pasca_Lebaran,_Senen_Bersih_dari_PKL"
2014-08-01T00:00:00Z,1899-12-31T06:10:35Z,"Sengketa Pilpres, KPU Jaktim Kumpulkan Bukti","https://beritajakarta.com/read/3915/Sengketa_Pilpres,_KPU_Jaktim_Kumpulkan_Bukti"
2014-08-01T00:00:00Z,1899-12-31T06:40:17Z,16 PMKS Terjaring Razia di Jakpus,https://beritajakarta.com/read/3916/16_PMKS_Terjaring_Razia_di_Jakpus
2014-08-01T00:00:00Z,1899-12-31T07:08:01Z,Puluhan Lapak PKL di Pasar Jiung Dibongkar,https://beritajakarta.com/read/3918/Puluhan_Lapak_PKL_di_Pasar_Jiung_Dibongkar
2014-08-01T00:00:00Z,1899-12-31T11:35:10Z,Kapal Kargo Terbakar di Perairan Tanjung Priok,https://beritajakarta.com/read/3920/Kapal_Kargo_Terbakar_di_Perairan_Tanjung_Priok
2014-08-02T00:00:00Z,1899-12-31T11:08:10Z,80 Truk Satpol PP Angkut Lapak Milik PKL,https://beritajakarta.com/read/3917/80_Truk_Satpol_PP_Angkut_Lapak_Milik_PKL
2014-08-02T00:00:00Z,1899-12-31T12:10:01Z,"Pasca Libur Lebaran, BKD Akan Sidak PNS DKI","https://beritajakarta.com/read/3921/Pasca_Libur_Lebaran,_BKD_Akan_Sidak_PNS_DKI"
2014-08-02T00:00:00Z,1899-12-31T02:32:31Z,PKL & Badut Monas Terjaring Razia Gabungan,https://beritajakarta.com/read/3922/PKL_&_Badut_Monas_Terjaring_Razia_Gabungan
2014-08-02T00:00:00Z,1899-12-31T03:05:32Z,Lapak PKL di Kolong Flyover Klender Dibongkar,https://beritajakarta.com/read/3924/Lapak_PKL_di_Kolong_Flyover_Klender_Dibongkar
2014-08-02T00:00:00Z,1899-12-31T04:55:04Z,9.833 Penumpang Arus Balik Tiba di Terminal Kalideres,https://beritajakarta.com/read/3925/9.833_Penumpang_Arus_Balik_Tiba_di_Terminal_Kalideres
2014-08-02T00:00:00Z,1899-12-31T05:15:32Z,PSK Kembali Marak di Jl Hayam Wuruk,https://beritajakarta.com/read/3926/PSK_Kembali_Marak_di_Jl_Hayam_Wuruk
2014-08-02T00:00:00Z,1899-12-31T07:00:32Z,Arus Balik di Terminal Rawamangun Sepi,https://beritajakarta.com/read/3923/Arus_Balik_di_Terminal_Rawamangun_Sepi
2014-08-03T00:00:00Z,1899-12-31T01:10:36Z,12 Rumah di Kelapa Gading Ludes Terbakar,https://beritajakarta.com/read/3927/12_Rumah_di_Kelapa_Gading_Ludes_Terbakar
2014-08-03T00:00:00Z,1899-12-31T02:25:54Z,Giliran PKL Tanah Abang Ditertibkan,https://beritajakarta.com/read/3929/Giliran_PKL_Tanah_Abang_Ditertibkan
2014-08-03T00:00:00Z,1899-12-31T05:03:35Z,Korban Kebakaran Penjaringan Butuh Bantuan,https://beritajakarta.com/read/3930/Korban_Kebakaran_Penjaringan_Butuh_Bantuan
2014-08-03T00:00:00Z,1899-12-31T05:26:28Z,Penertiban PKL Monas Dituntaskan Pekan Depan,https://beritajakarta.com/read/3932/Penertiban_PKL_Monas_Dituntaskan_Pekan_Depan
2014-08-03T00:00:00Z,1899-12-31T10:59:09Z,13.187 Pemudik Tiba di Stasiun Pasar Senen,https://beritajakarta.com/read/3933/13.187_Pemudik_Tiba_di_Stasiun_Pasar_Senen
2014-08-04T00:00:00Z,1899-12-31T09:31:21Z,Jokowi Halal Bihalal dengan PNS DKI,https://beritajakarta.com/read/3935/Jokowi_Halal_Bihalal_dengan_PNS_DKI
2014-08-04T00:00:00Z,1899-12-31T10:03:40Z,"Hari Pertama Kerja, BKD Sidak PNS","https://beritajakarta.com/read/3936/Hari_Pertama_Kerja,_BKD_Sidak_PNS"
2014-08-04T00:00:00Z,1899-12-31T11:21:58Z,"11 Agustus, Halte Koridor 1 Pakai Tiket Elektronik","https://beritajakarta.com/read/3937/11_Agustus,_Halte_Koridor_1_Pakai_Tiket_Elektronik"
2014-08-04T00:00:00Z,1899-12-31T12:40:17Z,Basuki Ancam Potong Tunjangan PNS Bolos,https://beritajakarta.com/read/3940/Basuki_Ancam_Potong_Tunjangan_PNS_Bolos
2014-08-04T00:00:00Z,1899-12-31T01:04:39Z,Basuki: Pendatang Tinggal di Pinggir Sungai Dipulangkan,https://beritajakarta.com/read/3938/Basuki:_Pendatang_Tinggal_di_Pinggir_Sungai_Dipulangkan
2014-08-04T00:00:00Z,1899-12-31T01:31:11Z,Basuki: Jakarta Terbuka bagi Kaum Pendatang,https://beritajakarta.com/read/3946/Basuki:_Jakarta_Terbuka_bagi_Kaum_Pendatang
2014-08-04T00:00:00Z,1899-12-31T02:02:26Z,Ratusan PKL Bendungan Melayu Ditertibkan,https://beritajakarta.com/read/3943/Ratusan_PKL_Bendungan_Melayu_Ditertibkan
2014-08-04T00:00:00Z,1899-12-31T02:19:59Z,Kolong Flyover Klender Dijaga Satpol PP,https://beritajakarta.com/read/3941/Kolong_Flyover_Klender_Dijaga_Satpol_PP
2014-08-04T00:00:00Z,1899-12-31T03:01:23Z,Basuki Persenjatai Satpol PP di Monas,https://beritajakarta.com/read/3948/Basuki_Persenjatai_Satpol_PP_di_Monas_
2014-08-04T00:00:00Z,1899-12-31T03:22:56Z,Pendatang Baru Jadi Korban Pembiusan,https://beritajakarta.com/read/3950/Pendatang_Baru_Jadi_Korban_Pembiusan
2014-08-04T00:00:00Z,1899-12-31T04:05:33Z,118 PNS Walikota Jaktim Tak Hadir,https://beritajakarta.com/read/3954/118_PNS_Walikota_Jaktim_Tak_Hadir
2014-08-04T00:00:00Z,1899-12-31T04:32:10Z,"Sejak Malam Takbiran, 3.500 PKL Ditertibkan","https://beritajakarta.com/read/3952/Sejak_Malam_Takbiran,_3.500_PKL_Ditertibkan"
2014-08-04T00:00:00Z,1899-12-31T05:12:26Z,Penertiban di Bongkaran Tanah Abang Tanpa Perlawanan,https://beritajakarta.com/read/3953/Penertiban_di_Bongkaran_Tanah_Abang_Tanpa_Perlawanan
2014-08-04T00:00:00Z,1899-12-31T05:20:39Z,Basuki: Jakarta Seperti Gula yang Disemutin,https://beritajakarta.com/read/3949/Basuki:_Jakarta_Seperti_Gula_yang_Disemutin_
2014-08-04T00:00:00Z,1899-12-31T06:19:52Z,"Jokowi: September, Rusunawa Muara Baru Rampung","https://beritajakarta.com/read/3957/Jokowi:_September,_Rusunawa_Muara_Baru_Rampung"
2014-08-04T00:00:00Z,1899-12-31T07:15:33Z,Wisatawan Habiskan Rp 40 M di Pulau Seribu,https://beritajakarta.com/read/3958/Wisatawan_Habiskan_Rp_40_M_di_Pulau_Seribu
2014-08-04T00:00:00Z,1899-12-31T08:06:26Z,Kolong Flyover Klender Akan Disulap Jadi Taman Interaktif,https://beritajakarta.com/read/3963/Kolong_Flyover_Klender_Akan_Disulap_Jadi_Taman_Interaktif
2014-08-04T00:00:00Z,1899-12-31T08:50:27Z,"Bogor Diguyur Hujan, Jakarta Siaga Banjir Kiriman","https://beritajakarta.com/read/3967/_Bogor_Diguyur_Hujan,_Jakarta_Siaga_Banjir_Kiriman_"
2014-08-04T00:00:00Z,1899-12-31T08:56:29Z,DKI Tertibkan Bangunan Liar di Kanal Banjir Barat,https://beritajakarta.com/read/3955/DKI_Tertibkan_Bangunan_Liar_di_Kanal_Banjir_Barat
2014-08-04T00:00:00Z,1899-12-31T09:06:16Z,Pendatang Tergiur Tingginya UMP di Jakarta,https://beritajakarta.com/read/3962/Pendatang_Tergiur_Tingginya_UMP_di_Jakarta
2014-08-05T00:00:00Z,1899-12-31T10:14:16Z,Polda Siapkan 8 SSK Amankan Sidang Pemilu di MK,https://beritajakarta.com/read/3968/Polda_Siapkan_8_SSK_Amankan_Sidang_Pemilu_di_MK
2014-08-05T00:00:00Z,1899-12-31T11:01:19Z,Penertiban PKL IRTI Monas Diundur,https://beritajakarta.com/read/3970/Penertiban_PKL_IRTI_Monas_Diundur
2014-08-05T00:00:00Z,1899-12-31T11:08:03Z,"Kampung Pulo Tergenang hingga 1,5 Meter","https://beritajakarta.com/read/3974/_Kampung_Pulo_Tergenang_hingga_1,5_Meter"
2014-08-05T00:00:00Z,1899-12-31T11:38:50Z,Basuki Silaturahmi dengan Pedagang Pasar Kaget,https://beritajakarta.com/read/3973/Basuki_Silaturahmi_dengan_Pedagang_Pasar_Kaget_
2014-08-05T00:00:00Z,1899-12-31T12:42:55Z,Proyek Apartemen Bikin Jalan Rusak,https://beritajakarta.com/read/3975/Proyek_Apartemen_Bikin_Jalan_Rusak_
2014-08-05T00:00:00Z,1899-12-31T02:35:04Z,71 Kendaraan Terkena Razia Parkir Liar,https://beritajakarta.com/read/3980/71_Kendaraan_Terkena_Razia_Parkir_Liar
2014-08-05T00:00:00Z,1899-12-31T03:24:13Z,DKI Akan Perbaiki Sistem Perparkiran,https://beritajakarta.com/read/3983/DKI_Akan_Perbaiki_Sistem_Perparkiran
2014-08-05T00:00:00Z,1899-12-31T04:28:05Z,Stok Darah di PMI DKI Menipis,https://beritajakarta.com/read/3981/Stok_Darah_di_PMI_DKI_Menipis
2014-08-05T00:00:00Z,1899-12-31T04:48:15Z,Dana KJP Rp 670 Miliar Segera Cair,https://beritajakarta.com/read/3989/Dana_KJP_Rp_670_Miliar_Segera_Cair
2014-08-05T00:00:00Z,1899-12-31T05:08:44Z,509 PNS DKI Tidak Masuk Kerja,https://beritajakarta.com/read/3977/509_PNS_DKI_Tidak_Masuk_Kerja
2014-08-05T00:00:00Z,1899-12-31T06:15:50Z,Basuki: Penertiban PKL Monas Lebih Mudah Dibanding Tanah Abang,https://beritajakarta.com/read/3986/Basuki:_Penertiban_PKL_Monas_Lebih_Mudah_Dibanding_Tanah_Abang_
2014-08-05T00:00:00Z,1899-12-31T07:06:40Z,Bus Masih Masuk Terminal Lebak Bulus,https://beritajakarta.com/read/3987/Bus_Masih_Masuk_Terminal_Lebak_Bulus
2014-08-05T00:00:00Z,1899-12-31T07:36:00Z,Arus Balik di Pelabuhan Tanjung Priok Meningkat,https://beritajakarta.com/read/3993/Arus_Balik_di_Pelabuhan_Tanjung_Priok_Meningkat
2014-08-05T00:00:00Z,1899-12-31T08:03:22Z,Basuki Diminta Jadi Irup HUT RI di Kampung Nelayan,https://beritajakarta.com/read/3996/Basuki_Diminta_Jadi_Irup_HUT_RI_di_Kampung_Nelayan
2014-08-06T00:00:00Z,1899-12-31T09:21:09Z,Satpol PP Bongkar 25 Lapak di Palmerah,https://beritajakarta.com/read/3978/Satpol_PP_Bongkar_25_Lapak_di_Palmerah
2014-08-06T00:00:00Z,1899-12-31T10:09:54Z,"Tertibkan Monas, DKI Dapat Dukungan TNI & Polri","https://beritajakarta.com/read/3979/Tertibkan_Monas,_DKI_Dapat_Dukungan_TNI_&_Polri"
2014-08-06T00:00:00Z,1899-12-31T10:24:32Z,299 Pemudik Berobat ke Posko Kesehatan,https://beritajakarta.com/read/3994/299_Pemudik_Berobat_ke_Posko_Kesehatan
2014-08-06T00:00:00Z,1899-12-31T10:57:27Z,Rusunawa Pulogebang Rawan Pencurian Motor,https://beritajakarta.com/read/3991/Rusunawa_Pulogebang_Rawan_Pencurian_Motor
2014-08-06T00:00:00Z,1899-12-31T11:10:05Z,Tembok Kantor Pengadilan Tinggi Jakarta Roboh,https://beritajakarta.com/read/3999/Tembok_Kantor_Pengadilan_Tinggi_Jakarta_Roboh
2014-08-06T00:00:00Z,1899-12-31T11:39:37Z,Massa Pendukung Prabowo Datangi Gedung MK,https://beritajakarta.com/read/4001/Massa_Pendukung_Prabowo_Datangi_Gedung_MK
2014-08-06T00:00:00Z,1899-12-31T12:31:47Z,20 Taman di Jaktim Rusak,https://beritajakarta.com/read/4000/20_Taman_di_Jaktim_Rusak
2014-08-06T00:00:00Z,1899-12-31T12:50:23Z,"Sidang MK, Rute Transjakarta Diperpendek","https://beritajakarta.com/read/4002/Sidang_MK,_Rute_Transjakarta_Diperpendek"
2014-08-06T00:00:00Z,1899-12-31T01:11:00Z,Proyek Rusun Daan Mogot Dikebut,https://beritajakarta.com/read/3985/Proyek_Rusun_Daan_Mogot_Dikebut
2014-08-06T00:00:00Z,1899-12-31T01:54:23Z,Jokowi: Orang Kaya Antre Masuk Rusunawa,https://beritajakarta.com/read/3995/Jokowi:_Orang_Kaya_Antre_Masuk_Rusunawa
2014-08-06T00:00:00Z,1899-12-31T02:06:12Z,Basuki Minta Semua Warga DKI Punya Rekening Bank,https://beritajakarta.com/read/4003/Basuki_Minta_Semua_Warga_DKI_Punya_Rekening_Bank_
2014-08-06T00:00:00Z,1899-12-31T02:30:41Z,Karyawati Dilecehkan di Dalam Angkutan Umum,https://beritajakarta.com/read/4006/Karyawati_Dilecehkan_di_Dalam_Angkutan_Umum
2014-08-06T00:00:00Z,1899-12-31T03:03:22Z,"Razia Parkir Liar, 70 Kendaraan Dicabut Pentil","https://beritajakarta.com/read/4005/Razia_Parkir_Liar,_70_Kendaraan_Dicabut_Pentil"
2014-08-06T00:00:00Z,1899-12-31T03:18:18Z,Truk Pengangkut Besi Terguling di Tol Cawang,https://beritajakarta.com/read/4011/Truk_Pengangkut_Besi_Terguling_di_Tol_Cawang
2014-08-06T00:00:00Z,1899-12-31T04:01:24Z,"PKL Marak, Omset Pedagang Pasar Lokomotif Merosot","https://beritajakarta.com/read/4004/PKL_Marak,_Omset_Pedagang_Pasar_Lokomotif_Merosot"
2014-08-06T00:00:00Z,1899-12-31T04:17:54Z,"Stres Berat, Lasro Ingin Mundur dari Kadisdik","https://beritajakarta.com/read/4010/Stres_Berat,_Lasro_Ingin_Mundur_dari_Kadisdik_"
2014-08-06T00:00:00Z,1899-12-31T05:39:06Z,"Angin Kencang, Pohon Rindang Mulai Dipangkas","https://beritajakarta.com/read/4009/Angin_Kencang,_Pohon_Rindang_Mulai_Dipangkas"
2014-08-06T00:00:00Z,1899-12-31T06:58:20Z,Perbaikan Jembatan di Semper Barat Mangkrak,https://beritajakarta.com/read/4012/Perbaikan_Jembatan_di_Semper_Barat_Mangkrak
2014-08-06T00:00:00Z,1899-12-31T07:15:46Z,Pembangunan Waduk Marunda Rampung Akhir Tahun,https://beritajakarta.com/read/4019/Pembangunan_Waduk_Marunda_Rampung_Akhir_Tahun
2014-08-06T00:00:00Z,1899-12-31T07:33:40Z,"Bangun Jalan Layang Transjakarta, DKI Siapkan Rp 2,5 T","https://beritajakarta.com/read/4007/Bangun_Jalan_Layang_Transjakarta,_DKI_Siapkan_Rp_2,5_T"
2014-08-06T00:00:00Z,1899-12-31T08:03:03Z,Akses Jalan ke SMP 289 Cilincing Belum Diaspal,https://beritajakarta.com/read/4008/Akses_Jalan_ke_SMP_289_Cilincing_Belum_Diaspal
2014-08-06T00:00:00Z,1899-12-31T08:32:41Z,Ratusan PKL Kembali Geruduk Monas,https://beritajakarta.com/read/4022/Ratusan_PKL_Kembali_Geruduk_Monas
2014-08-06T00:00:00Z,1899-12-31T08:48:21Z,DKI Akan Bangun Sirkuit Motor,https://beritajakarta.com/read/4018/DKI_Akan_Bangun_Sirkuit_Motor_
2014-08-06T00:00:00Z,1899-12-31T09:03:52Z,Sampah di TPS Duren Sawit Menggunung,https://beritajakarta.com/read/4013/Sampah_di_TPS_Duren_Sawit_Menggunung
2014-08-06T00:00:00Z,1899-12-31T09:22:09Z,Basuki Janjikan Seluruh Jalur Transjakarta Mulus,https://beritajakarta.com/read/4014/Basuki_Janjikan_Seluruh_Jalur_Transjakarta_Mulus
2014-08-07T00:00:00Z,1899-12-31T01:30:43Z,7 Warung di Atas Saluran Air Dibongkar,https://beritajakarta.com/read/4025/7_Warung_di_Atas_Saluran_Air_Dibongkar
2014-08-07T00:00:00Z,1899-12-31T01:50:40Z,Basuki Rahasiakan Jabatan Baru Lasro Marbun,https://beritajakarta.com/read/4029/Basuki_Rahasiakan_Jabatan_Baru_Lasro_Marbun
2014-08-07T00:00:00Z,1899-12-31T02:43:02Z,Basuki Siap Selesaikan PR yang Ditinggalkan Jokowi,https://beritajakarta.com/read/4033/Basuki_Siap_Selesaikan_PR_yang_Ditinggalkan_Jokowi
2014-08-07T00:00:00Z,1899-12-31T03:19:49Z,Lasro Belum Serahkan Surat Pengunduran Diri,https://beritajakarta.com/read/4037/Lasro_Belum_Serahkan_Surat_Pengunduran_Diri
2014-08-07T00:00:00Z,1899-12-31T03:39:20Z,150 Lapak PKL di Ciracas Ditertibkan,https://beritajakarta.com/read/4034/150_Lapak_PKL_di_Ciracas_Ditertibkan
2014-08-07T00:00:00Z,1899-12-31T04:00:22Z,Basuki : Siswi Tak Wajib Pakai Kebaya Encim,https://beritajakarta.com/read/4038/Basuki_:_Siswi_Tak_Wajib_Pakai_Kebaya_Encim
2014-08-07T00:00:00Z,1899-12-31T04:50:14Z,Bus Transjakarta Gandeng Terlepas,https://beritajakarta.com/read/4044/Bus_Transjakarta_Gandeng_Terlepas
2014-08-07T00:00:00Z,1899-12-31T05:16:56Z,Kebijakan Transaksi Non Cash Diapresiasi BI,https://beritajakarta.com/read/4039/Kebijakan_Transaksi_Non_Cash_Diapresiasi_BI
2014-08-07T00:00:00Z,1899-12-31T05:35:31Z,Pemohon Uji Kir di PKB Cilincing Membludak,https://beritajakarta.com/read/4027/Pemohon_Uji_Kir_di_PKB_Cilincing_Membludak
2014-08-07T00:00:00Z,1899-12-31T06:01:15Z,Basuki: Bus Patah Karena Jalan Bergelombang,https://beritajakarta.com/read/4050/Basuki:_Bus_Patah_Karena_Jalan_Bergelombang
2014-08-07T00:00:00Z,1899-12-31T06:37:52Z,Jokowi: Jakarta Siap Jadi Tuan Rumah Asian Games,https://beritajakarta.com/read/4051/Jokowi:_Jakarta_Siap_Jadi_Tuan_Rumah_Asian_Games
2014-08-07T00:00:00Z,1899-12-31T07:03:04Z,Pemprov DKI Kebut Sejumlah Proyek Pembangunan,https://beritajakarta.com/read/4054/Pemprov_DKI_Kebut_Sejumlah_Proyek_Pembangunan
2014-08-07T00:00:00Z,1899-12-31T07:41:05Z,Baru Lima Kegiatan SDPU Jalan Jakbar yang Siap Dikerjakan,https://beritajakarta.com/read/4030/Baru_Lima_Kegiatan_SDPU_Jalan_Jakbar_yang_Siap_Dikerjakan
2014-08-07T00:00:00Z,1899-12-31T07:53:01Z,Lahan Parkir Blok G Tanah Abang Tidak Memadai,https://beritajakarta.com/read/4042/Lahan_Parkir_Blok_G_Tanah_Abang_Tidak_Memadai
2014-08-07T00:00:00Z,1899-12-31T08:06:54Z,"Halau PKL, Polda Bangun Pos Pengamanan di Monas","https://beritajakarta.com/read/4046/Halau_PKL,_Polda_Bangun_Pos_Pengamanan_di_Monas"
2014-08-07T00:00:00Z,1899-12-31T08:31:22Z,36 Karyawan Perusahaan Kosmetik Keracunan Makanan,https://beritajakarta.com/read/4057/36_Karyawan_Perusahaan_Kosmetik_Keracunan_Makanan
2014-08-07T00:00:00Z,1899-12-31T08:41:45Z,Jembatan Jeling Dipagari Besi,https://beritajakarta.com/read/4053/Jembatan_Jeling_Dipagari_Besi
2014-08-07T00:00:00Z,1899-12-31T08:54:11Z,4 RW Terkena Proyek Perluasan New Port Tanjung Priok,https://beritajakarta.com/read/4045/4_RW_Terkena_Proyek_Perluasan_New_Port_Tanjung_Priok
2014-08-07T00:00:00Z,1899-12-31T09:06:42Z,PKL Jalan Palmeriam Akan Ditertibkan,https://beritajakarta.com/read/4040/PKL_Jalan_Palmeriam_Akan_Ditertibkan
2014-08-07T00:00:00Z,1899-12-31T09:18:06Z,"Selama Lebaran, PMKS di Jakpus Meningkat","https://beritajakarta.com/read/4026/Selama_Lebaran,_PMKS_di_Jakpus_Meningkat"
2014-08-07T00:00:00Z,1899-12-31T09:34:47Z,Proyek Sodetan Ciliwung Molor,https://beritajakarta.com/read/4031/Proyek_Sodetan_Ciliwung_Molor
2014-08-08T00:00:00Z,1899-12-31T09:44:11Z,Stadion BMW Jadi Tempat Pembukaan Asian Games 2018,https://beritajakarta.com/read/4058/Stadion_BMW_Jadi_Tempat_Pembukaan_Asian_Games_2018
2014-08-08T00:00:00Z,1899-12-31T10:08:42Z,Lasro Dinilai Gagal Pimpin Dinas Pendidikan,https://beritajakarta.com/read/4060/Lasro_Dinilai_Gagal_Pimpin_Dinas_Pendidikan
2014-08-08T00:00:00Z,1899-12-31T11:09:07Z,Bangunan Liar di Bantaran Kali Mookevart Akan Dibongkar,https://beritajakarta.com/read/4059/Bangunan_Liar_di_Bantaran_Kali_Mookevart_Akan_Dibongkar
2014-08-08T00:00:00Z,1899-12-31T01:14:22Z,KRL Terganggu Akibat Penumpang Tarik Rem Darurat,https://beritajakarta.com/read/4063/KRL_Terganggu_Akibat_Penumpang_Tarik_Rem_Darurat
2014-08-08T00:00:00Z,1899-12-31T01:39:02Z,Siswa SD Tewas Ditabrak KA,https://beritajakarta.com/read/4061/Siswa_SD_Tewas_Ditabrak_KA
2014-08-08T00:00:00Z,1899-12-31T02:13:40Z,Mess Guru di Jakbar Hangus Terbakar,https://beritajakarta.com/read/4071/Mess_Guru_di_Jakbar_Hangus_Terbakar
2014-08-08T00:00:00Z,1899-12-31T02:36:01Z,"Penertiban Ricuh, 3 Petugas PT KAI Terluka","https://beritajakarta.com/read/4066/Penertiban_Ricuh,_3_Petugas_PT_KAI_Terluka"
2014-08-08T00:00:00Z,1899-12-31T03:09:54Z,Hari Masuk Sekolah Akan Diseragamkan,https://beritajakarta.com/read/4065/Hari_Masuk_Sekolah_Akan_Diseragamkan
2014-08-08T00:00:00Z,1899-12-31T03:39:06Z,"Cegah Pendatang Baru, Daerah Harus Diberdayakan","https://beritajakarta.com/read/4064/Cegah_Pendatang_Baru,_Daerah_Harus_Diberdayakan"
2014-08-08T00:00:00Z,1899-12-31T04:12:25Z,DKI Akan Tutup Agen TKI Ilegal,https://beritajakarta.com/read/4062/DKI_Akan_Tutup_Agen_TKI_Ilegal
2014-08-08T00:00:00Z,1899-12-31T04:41:13Z,Dana BOP Akan Disalurkan Langsung ke Sekolah,https://beritajakarta.com/read/4073/Dana_BOP_Akan_Disalurkan_Langsung_ke_Sekolah
2014-08-08T00:00:00Z,1899-12-31T05:18:06Z,Pemkot Jakpus Kembali Gelar Festival Layang-layang,https://beritajakarta.com/read/4075/Pemkot_Jakpus_Kembali_Gelar_Festival_Layang-layang
2014-08-08T00:00:00Z,1899-12-31T05:38:11Z,"Jadi Penampungan PKL Liar, IRTI Monas Akan Dikosongkan","https://beritajakarta.com/read/4069/Jadi_Penampungan_PKL_Liar,_IRTI_Monas_Akan_Dikosongkan"
2014-08-08T00:00:00Z,1899-12-31T06:18:10Z,Petugas Kir Nakal Diminta Mengundurkan Diri,https://beritajakarta.com/read/4082/Petugas_Kir_Nakal_Diminta_Mengundurkan_Diri
2014-08-08T00:00:00Z,1899-12-31T08:48:08Z,Lelang di Pemprov DKI Bisa Dipercepat,https://beritajakarta.com/read/4086/Lelang_di_Pemprov_DKI_Bisa_Dipercepat
2014-08-08T00:00:00Z,1899-12-31T09:41:18Z,"Meresahkan, PMKS Mabuk Dirazia","https://beritajakarta.com/read/4083/Meresahkan,_PMKS_Mabuk_Dirazia"
2014-08-08T00:00:00Z,1899-12-31T10:14:09Z,Pembebasan Waduk Marunda Kekurangan Dana Rp 185 Miliar,https://beritajakarta.com/read/4077/Pembebasan_Waduk_Marunda_Kekurangan_Dana_Rp_185_Miliar
2014-08-08T00:00:00Z,1899-12-31T10:35:31Z,24 Ribu Nelayan Kena Imbas Pembatasan Solar,https://beritajakarta.com/read/4074/24_Ribu_Nelayan_Kena_Imbas_Pembatasan_Solar
2014-08-09T00:00:00Z,1899-12-31T01:11:03Z,DKI Akan Rombak Pejabat Eselon II,https://beritajakarta.com/read/4087/DKI_Akan_Rombak_Pejabat_Eselon_II
2014-08-09T00:00:00Z,1899-12-31T02:09:22Z,"Tanpa KTP DKI, 31 Pedagang IRTI Monas Dicoret","https://beritajakarta.com/read/4084/Tanpa_KTP_DKI,_31_Pedagang_IRTI_Monas_Dicoret"
2014-08-09T00:00:00Z,1899-12-31T03:17:59Z,Bulan Depan Harga Sembako Diprediksi Naik,https://beritajakarta.com/read/4080/Bulan_Depan_Harga_Sembako_Diprediksi_Naik
2014-08-09T00:00:00Z,1899-12-31T04:06:14Z,Jembatan Danau Sunter Belum Diperbaiki,https://beritajakarta.com/read/4091/Jembatan_Danau_Sunter_Belum_Diperbaiki
2014-08-09T00:00:00Z,1899-12-31T04:32:19Z,Rusun Pinus Elok Dilengkapi Sarana Ibadah,https://beritajakarta.com/read/4092/Rusun_Pinus_Elok_Dilengkapi_Sarana_Ibadah
2014-08-09T00:00:00Z,1899-12-31T05:06:28Z,Mengenal Budaya Betawi Lewat Festival Setu Babakan,https://beritajakarta.com/read/4094/Mengenal_Budaya_Betawi_Lewat_Festival_Setu_Babakan
2014-08-09T00:00:00Z,1899-12-31T05:32:27Z,"Halau PKL, Trotoar Dipasangi Pot Bunga","https://beritajakarta.com/read/4090/Halau_PKL,_Trotoar_Dipasangi_Pot_Bunga"
2014-08-09T00:00:00Z,1899-12-31T05:46:50Z,Halte Transjakarta Walikota Jakut Minim Penerangan,https://beritajakarta.com/read/4096/Halte_Transjakarta_Walikota_Jakut_Minim_Penerangan
2014-08-09T00:00:00Z,1899-12-31T06:24:54Z,Ribuan Makam di TPU Kapuk Teko Kembali Terendam,https://beritajakarta.com/read/4095/Ribuan_Makam_di_TPU_Kapuk_Teko_Kembali_Terendam
2014-08-09T00:00:00Z,1899-12-31T06:50:33Z,"Operasi Binduk, Dukcapil Sasar Rumah Kontrakan","https://beritajakarta.com/read/4089/Operasi_Binduk,_Dukcapil_Sasar_Rumah_Kontrakan_"
2014-08-09T00:00:00Z,1899-12-31T07:30:59Z,"Instalasi Pengairan Dicuri, Taman Vertikal Mengering","https://beritajakarta.com/read/4097/Instalasi_Pengairan_Dicuri,_Taman_Vertikal_Mengering"
2014-08-10T00:00:00Z,1899-12-31T11:38:34Z,"Car Free Day, Warga Padati Sudirman-Thamrin","https://beritajakarta.com/read/4098/Car_Free_Day,_Warga_Padati_Sudirman-Thamrin"
2014-08-10T00:00:00Z,1899-12-31T01:12:24Z,1.700 Polisi Amankan Laga Persija-Persib,https://beritajakarta.com/read/4100/1.700_Polisi_Amankan_Laga_Persija-Persib_
2014-08-10T00:00:00Z,1899-12-31T02:14:48Z,Car Free Day Ditiadakan di Hari Kemerdekaan,https://beritajakarta.com/read/4102/Car_Free_Day_Ditiadakan_di_Hari_Kemerdekaan
2014-08-10T00:00:00Z,1899-12-31T04:19:54Z,Warga Banyuwangi Diminta Ikut Benahi Jakarta,https://beritajakarta.com/read/4104/Warga_Banyuwangi_Diminta_Ikut_Benahi_Jakarta
2014-08-10T00:00:00Z,1899-12-31T05:04:58Z,Nelayan Kamal Muara Butuh SPDN,https://beritajakarta.com/read/4099/Nelayan_Kamal_Muara_Butuh_SPDN
2014-08-10T00:00:00Z,1899-12-31T05:26:57Z,Pagar Taman di Jl Raya Bogor Dirusak PKL,https://beritajakarta.com/read/4103/Pagar_Taman_di_Jl_Raya_Bogor_Dirusak_PKL
2014-08-11T00:00:00Z,1899-12-31T08:57:19Z,"Rumah Anggota DPR Terbakar, Kerugian Rp 2,5 M","https://beritajakarta.com/read/4107/Rumah_Anggota_DPR_Terbakar,_Kerugian_Rp_2,5_M"
2014-08-11T00:00:00Z,1899-12-31T09:59:01Z,Taman di Menteng Tidak Terawat,https://beritajakarta.com/read/4106/Taman_di_Menteng_Tidak_Terawat
2014-08-11T00:00:00Z,1899-12-31T10:41:34Z,Warga Bintaro Tolak Pembangunan Apartemen,https://beritajakarta.com/read/4108/Warga_Bintaro_Tolak_Pembangunan_Apartemen
2014-08-11T00:00:00Z,1899-12-31T12:55:59Z,Kantor PT KPU di Gambir Dibongkar,https://beritajakarta.com/read/4110/Kantor_PT_KPU_di_Gambir_Dibongkar
2014-08-11T00:00:00Z,1899-12-31T01:37:00Z,DKI Akan Evaluasi Transjakarta Produk Inka,https://beritajakarta.com/read/4112/DKI_Akan_Evaluasi_Transjakarta_Produk_Inka
2014-08-11T00:00:00Z,1899-12-31T01:58:33Z,Rencana Pengosongan Pedagang IRTI Dikritik,https://beritajakarta.com/read/4109/Rencana_Pengosongan_Pedagang_IRTI_Dikritik
2014-08-11T00:00:00Z,1899-12-31T02:11:03Z,82 PKL di Cengkareng Ditertibkan,https://beritajakarta.com/read/4113/82_PKL_di_Cengkareng_Ditertibkan
2014-08-11T00:00:00Z,1899-12-31T02:50:47Z,Sidang Perdana Kasus Penganiayaan Siswa SMAN 3 Digelar,https://beritajakarta.com/read/4114/Sidang_Perdana_Kasus_Penganiayaan_Siswa_SMAN_3_Digelar
2014-08-11T00:00:00Z,1899-12-31T03:12:53Z,DKI Siapkan Aplikasi Android Tampung Keluhan Warga,https://beritajakarta.com/read/4115/DKI_Siapkan_Aplikasi_Android_Tampung_Keluhan_Warga
2014-08-11T00:00:00Z,1899-12-31T03:39:58Z,Siswa BPK Penabur Diungsikan ke Sekolah Sementara,https://beritajakarta.com/read/4116/Siswa_BPK_Penabur_Diungsikan_ke_Sekolah_Sementara
2014-08-11T00:00:00Z,1899-12-31T04:18:47Z,Balap Liar Kembali Marak di Kembangan,https://beritajakarta.com/read/4120/Balap_Liar_Kembali_Marak_di_Kembangan
2014-08-11T00:00:00Z,1899-12-31T05:08:45Z,52 Kendaraan di Cengkareng Terjaring Razia,https://beritajakarta.com/read/4123/52_Kendaraan_di_Cengkareng_Terjaring_Razia
2014-08-11T00:00:00Z,1899-12-31T05:14:14Z,"2017, Transjakarta Koridor XI Lewat Jalan Layang","https://beritajakarta.com/read/4117/2017,_Transjakarta_Koridor_XI_Lewat_Jalan_Layang"
2014-08-11T00:00:00Z,1899-12-31T05:50:34Z,"Tarik Mobil Dinas, DKI Hemat Rp 250 Miliar","https://beritajakarta.com/read/4124/Tarik_Mobil_Dinas,_DKI_Hemat_Rp_250_Miliar"
2014-08-11T00:00:00Z,1899-12-31T06:05:09Z,Layanan Publik di DKI Diapresiasi Universitas di Singapura,https://beritajakarta.com/read/4121/Layanan_Publik_di_DKI_Diapresiasi_Universitas_di_Singapura
2014-08-11T00:00:00Z,1899-12-31T07:12:48Z,Ratusan Kapal Antre Solar di Pelabuhan Muara Angke,https://beritajakarta.com/read/4126/Ratusan_Kapal_Antre_Solar_di_Pelabuhan_Muara_Angke
2014-08-11T00:00:00Z,1899-12-31T07:27:43Z,18 Titik Genangan Terjadi di DKI,https://beritajakarta.com/read/4133/18_Titik_Genangan_Terjadi_di_DKI
2014-08-11T00:00:00Z,1899-12-31T07:36:33Z,"Lantik 48 Pejabat, Sekda Ingatkan Penyerapan Anggaran","https://beritajakarta.com/read/4128/Lantik_48_Pejabat,_Sekda_Ingatkan_Penyerapan_Anggaran"
